{
  "$schema": "https://json-schema.org/draft/2020-12/schema",
  "type": "object",
  "properties": {
    "grain": {
      "type": "string",
      "const": "week"
    },
    "period": {
      "type": "string"
    },
    "repo": {
      "type": "string"
    },
    "coordinator_root_path": {
      "type": "string"
    },
    "deterministic_facts": {
      "type": "object",
      "properties": {
        "chains_completed": {
          "type": "integer",
          "minimum": -9007199254740991,
          "maximum": 9007199254740991
        },
        "tshirt_counts": {
          "type": "object",
          "propertyNames": {
            "type": "string"
          },
          "additionalProperties": {
            "type": "integer",
            "minimum": -9007199254740991,
            "maximum": 9007199254740991
          }
        },
        "opus_dispatches": {
          "type": "integer",
          "minimum": -9007199254740991,
          "maximum": 9007199254740991
        },
        "commits": {
          "type": "integer",
          "minimum": -9007199254740991,
          "maximum": 9007199254740991
        },
        "reviews_conducted": {
          "type": "integer",
          "minimum": -9007199254740991,
          "maximum": 9007199254740991
        },
        "verdicts": {
          "type": "object",
          "propertyNames": {
            "type": "string"
          },
          "additionalProperties": {
            "type": "integer",
            "minimum": -9007199254740991,
            "maximum": 9007199254740991
          }
        }
      },
      "required": [
        "chains_completed",
        "tshirt_counts",
        "opus_dispatches",
        "commits",
        "reviews_conducted",
        "verdicts"
      ],
      "additionalProperties": false
    },
    "narrative": {
      "anyOf": [
        {
          "type": "object",
          "properties": {
            "text": {
              "type": "string"
            },
            "generated_by": {
              "type": "string"
            },
            "generated_at": {
              "type": "string",
              "format": "date-time",
              "pattern": "^(?:(?:\\d\\d[2468][048]|\\d\\d[13579][26]|\\d\\d0[48]|[02468][048]00|[13579][26]00)-02-29|\\d{4}-(?:(?:0[13578]|1[02])-(?:0[1-9]|[12]\\d|3[01])|(?:0[469]|11)-(?:0[1-9]|[12]\\d|30)|(?:02)-(?:0[1-9]|1\\d|2[0-8])))T(?:(?:[01]\\d|2[0-3]):[0-5]\\d(?::[0-5]\\d(?:\\.\\d+)?)?(?:Z|([+-](?:[01]\\d|2[0-3]):[0-5]\\d)))$"
            },
            "input_watermark": {
              "type": "object",
              "properties": {
                "max_observed_at": {
                  "type": "string",
                  "format": "date-time",
                  "pattern": "^(?:(?:\\d\\d[2468][048]|\\d\\d[13579][26]|\\d\\d0[48]|[02468][048]00|[13579][26]00)-02-29|\\d{4}-(?:(?:0[13578]|1[02])-(?:0[1-9]|[12]\\d|3[01])|(?:0[469]|11)-(?:0[1-9]|[12]\\d|30)|(?:02)-(?:0[1-9]|1\\d|2[0-8])))T(?:(?:[01]\\d|2[0-3]):[0-5]\\d(?::[0-5]\\d(?:\\.\\d+)?)?(?:Z|([+-](?:[01]\\d|2[0-3]):[0-5]\\d)))$"
                },
                "max_commit_sha": {
                  "type": "string"
                },
                "source_count": {
                  "type": "integer",
                  "minimum": -9007199254740991,
                  "maximum": 9007199254740991
                }
              },
              "required": [
                "max_observed_at",
                "max_commit_sha",
                "source_count"
              ],
              "additionalProperties": false
            }
          },
          "required": [
            "text",
            "generated_by",
            "generated_at",
            "input_watermark"
          ],
          "additionalProperties": false
        },
        {
          "type": "null"
        }
      ]
    },
    "input_watermark": {
      "type": "object",
      "properties": {
        "max_observed_at": {
          "type": "string",
          "format": "date-time",
          "pattern": "^(?:(?:\\d\\d[2468][048]|\\d\\d[13579][26]|\\d\\d0[48]|[02468][048]00|[13579][26]00)-02-29|\\d{4}-(?:(?:0[13578]|1[02])-(?:0[1-9]|[12]\\d|3[01])|(?:0[469]|11)-(?:0[1-9]|[12]\\d|30)|(?:02)-(?:0[1-9]|1\\d|2[0-8])))T(?:(?:[01]\\d|2[0-3]):[0-5]\\d(?::[0-5]\\d(?:\\.\\d+)?)?(?:Z|([+-](?:[01]\\d|2[0-3]):[0-5]\\d)))$"
        },
        "max_commit_sha": {
          "type": "string"
        },
        "source_count": {
          "type": "integer",
          "minimum": -9007199254740991,
          "maximum": 9007199254740991
        }
      },
      "required": [
        "max_observed_at",
        "max_commit_sha",
        "source_count"
      ],
      "additionalProperties": false
    },
    "freshness": {
      "type": "string",
      "enum": [
        "current",
        "stale"
      ]
    },
    "provenance": {
      "type": "object",
      "properties": {
        "source_kind": {
          "type": "string",
          "enum": [
            "github_graphql",
            "github_rest",
            "local_fs",
            "coordinator_artifact"
          ]
        },
        "repo": {
          "type": "string"
        },
        "ref": {
          "type": "object",
          "properties": {
            "branch": {
              "type": "string"
            },
            "sha": {
              "type": "string"
            }
          },
          "required": [
            "branch",
            "sha"
          ],
          "additionalProperties": false
        },
        "path": {
          "type": "string"
        },
        "observed_at": {
          "type": "string",
          "format": "date-time",
          "pattern": "^(?:(?:\\d\\d[2468][048]|\\d\\d[13579][26]|\\d\\d0[48]|[02468][048]00|[13579][26]00)-02-29|\\d{4}-(?:(?:0[13578]|1[02])-(?:0[1-9]|[12]\\d|3[01])|(?:0[469]|11)-(?:0[1-9]|[12]\\d|30)|(?:02)-(?:0[1-9]|1\\d|2[0-8])))T(?:(?:[01]\\d|2[0-3]):[0-5]\\d(?::[0-5]\\d(?:\\.\\d+)?)?(?:Z|([+-](?:[01]\\d|2[0-3]):[0-5]\\d)))$"
        },
        "derivation": {
          "type": "string",
          "enum": [
            "raw",
            "parsed",
            "rolled_up"
          ]
        }
      },
      "required": [
        "source_kind",
        "repo",
        "ref",
        "path",
        "observed_at",
        "derivation"
      ],
      "additionalProperties": false
    }
  },
  "required": [
    "grain",
    "period",
    "repo",
    "coordinator_root_path",
    "deterministic_facts",
    "narrative",
    "input_watermark",
    "freshness",
    "provenance"
  ],
  "additionalProperties": false
}
