{
  "grain": "week",
  "period": "2026-W25",
  "repo": "",
  "coordinator_root_path": ".",
  "deterministic_facts": {
    "chains_completed": 11,
    "tshirt_counts": { "XS": 3, "S": 4, "M": 3, "L": 1 },
    "opus_dispatches": 5,
    "commits": 84,
    "reviews_conducted": 6,
    "verdicts": { "ok": 3, "warn": 2, "blocked": 1 }
  },
  "narrative": null,
  "input_watermark": {
    "max_observed_at": "2026-06-22T17:59:00Z",
    "max_commit_sha": "647732fa",
    "source_count": 42
  },
  "freshness": "current",
  "provenance": {
    "source_kind": "coordinator_artifact",
    "repo": ".claude-prime",
    "ref": { "branch": "work/macbookair/2026-06-17to22", "sha": "647732fa" },
    "path": "state/week-changelog/HEADER.md",
    "observed_at": "2026-06-22T18:00:02Z",
    "derivation": "rolled_up"
  }
}
